{
  "schemaVersion": 1,
  "status": "published",
  "intro": {
    "eyebrow": "Pricing",
    "title": "按需选择，价格透明",
    "body": "从团队套餐到单品能力，按业务阶段灵活选配；私有化与特殊优化需求单独评估。"
  },
  "plans": [
    {
      "name": "免费版",
      "fit": "适合小团队体验企业文件协作",
      "price": "¥0",
      "unit": "/ 永久",
      "features": ["基础企业网盘", "团队共享与在线预览", "基础成员与权限管理", "适合快速试用"],
      "ctaLabel": "免费开始"
    },
    {
      "name": "团队版",
      "badge": "主推",
      "fit": "适合成长型企业与部门日常协作",
      "price": "¥79",
      "unit": "/ 人 / 月",
      "features": ["完整网盘与团队空间", "版本管理与外链分享", "更完整的权限与审计", "适合企业正式使用"],
      "ctaLabel": "立即试用",
      "highlight": true
    },
    {
      "name": "商业版",
      "fit": "适合对安全、权限和集成要求更高的企业",
      "price": "¥129",
      "unit": "/ 人 / 月",
      "features": ["高级权限与安全策略", "SSO / 企业组织集成", "API 与高级管理能力", "面向规模化使用"],
      "ctaLabel": "联系销售"
    }
  ],
  "products": [
    {
      "name": "安全外链分享",
      "summary": "受控外链，支持有效期、访问密码与下载策略。",
      "price": "¥39",
      "unit": "/ 空间 / 月",
      "note": "可与任意套餐叠加"
    },
    {
      "name": "审计与归档增强",
      "summary": "扩展审计范围与归档周期，满足合规与长期留存。",
      "price": "¥49",
      "unit": "/ 空间 / 月",
      "note": "面向合规要求较高的企业"
    },
    {
      "name": "超大容量包",
      "summary": "按需扩展企业空间存储容量，弹性应对增长。",
      "price": "¥0.05",
      "unit": "/ GB / 月",
      "note": "按实际用量计费"
    }
  ],
  "custom": [
    {
      "title": "私有化部署",
      "body": "数据保留在企业自有环境，支持专属存储、组织身份集成与定制实施服务。",
      "price": "按场景评估"
    },
    {
      "title": "特殊性能优化",
      "body": "针对超大文件、高并发访问与批量操作场景提供专项优化与性能保障。",
      "price": "按场景评估"
    },
    {
      "title": "定制集成",
      "body": "对接企业现有系统、S3 协议对象存储与统一身份体系，按业务定制。",
      "price": "按场景评估"
    }
  ],
  "promotions": [
    {
      "title": "团队版首年优惠",
      "body": "新客户订购团队版年付，享首年 8 折优惠，并赠送 1 个月安全外链增强。",
      "badge": "限时",
      "price": "¥55",
      "unit": "/ 人 / 月",
      "validUntil": "2026-09-30"
    },
    {
      "title": "商业化升级礼遇",
      "body": "由商业版升级，可享数据迁移服务与专属实施顾问支持。",
      "badge": "专属",
      "price": "面议",
      "validUntil": "2026-12-31"
    }
  ],
  "note": "* 页面价格可作为官网展示稿，正式上线前建议与后台套餐配置再次核对。单品与特价活动以签订合同时的报价为准。",
  "seo": {
    "title": "价格方案 | 一粒云",
    "description": "一粒云企业网盘价格透明：从团队套餐到单品能力，按需选配；私有化与特殊优化单独评估。",
    "keywords": ["一粒云", "企业网盘价格", "套餐", "单品价格", "特价活动"],
    "image": "media/yiliyun/hero.png"
  }
}
